[
  {
    "id": "res:vault:lucide-icons",
    "name": "Lucide Icons",
    "category": "icons",
    "description": "优美统一、轻量且拥有 1000+ 矢量图标的 Feather Icons 现代社区分支。",
    "recommendedReason": "现代 Web 应用界面首选图标集，提供 React、Vue 及 Svelte 官方绑定的开箱支持。",
    "author": "Lucide Contributors",
    "tags": ["图标库", "矢量", "React", "多格式支持"],
    "actionType": "github",
    "repository": "https://github.com/lucide-icons/lucide",
    "homepage": "https://lucide.dev",
    "stars": "16k+",
    "featured": true,
    "updatedAt": "2026-10-02"
  },
  {
    "id": "res:vault:svgl",
    "name": "SVGL",
    "category": "icons",
    "description": "极具美感且收录全面的世界顶尖科技品牌与开发工具官方 SVG Logo 库。",
    "recommendedReason": "开发项目文档、工具卡片和产品展示页面官方高清矢量 Logo 的即取即用首选。",
    "author": "E统一phraim",
    "tags": ["品牌Logo", "SVG", "科技品牌", "高清矢量"],
    "actionType": "external",
    "homepage": "https://svgl.app",
    "repository": "https://github.com/pheralb/svgl",
    "stars": "6k+",
    "featured": true,
    "updatedAt": "2026-10-02"
  },
  {
    "id": "res:vault:devicon",
    "name": "Devicon",
    "category": "icons",
    "description": "汇集各编程语言、框架与开发工具的官方风格图标集合。",
    "recommendedReason": "技术栈展示页与项目徽章的标准图标源，风格统一且持续跟随生态更新。",
    "author": "Devicon",
    "tags": ["技术图标", "语言图标", "徽章", "品牌风格"],
    "actionType": "github",
    "repository": "https://github.com/devicons/devicon",
    "homepage": "https://devicon.dev",
    "stars": "11.8k+",
    "license": "MIT",
    "featured": true,
    "updatedAt": "2026-10-04"
  },
  {
    "id": "res:vault:heroicons",
    "name": "Heroicons",
    "category": "icons",
    "description": "Tailwind 团队出品的 SVG 图标集，提供描边与实心两套风格。",
    "recommendedReason": "与 Tailwind 尺寸体系天然契合，网格严谨，界面中密度一致性最好。",
    "author": "Tailwind Labs",
    "tags": ["SVG图标", "描边实心", "Tailwind", "界面图标"],
    "actionType": "github",
    "repository": "https://github.com/tailwindlabs/heroicons",
    "homepage": "https://heroicons.com",
    "stars": "23.8k+",
    "license": "MIT",
    "featured": true,
    "updatedAt": "2026-10-04"
  },
  {
    "id": "res:vault:feather-icons",
    "name": "Feather Icons",
    "category": "icons",
    "description": "极简线性风格的开源 SVG 图标集，笔画统一为 2px。",
    "recommendedReason": "风格中性克制，几乎不干扰界面语气，是最保险的通用图标选择。",
    "author": "Cole Bemis",
    "tags": ["线性图标", "极简风格", "SVG", "通用"],
    "actionType": "github",
    "repository": "https://github.com/feathericons/feather",
    "homepage": "https://feathericons.com",
    "stars": "26k+",
    "license": "MIT",
    "featured": true,
    "updatedAt": "2026-10-04"
  },
  {
    "id": "res:vault:bootstrap-icons",
    "name": "Bootstrap Icons",
    "category": "icons",
    "description": "Bootstrap 官方图标库，数量充足且涵盖界面与品牌符号。",
    "recommendedReason": "与 Bootstrap 体系配套的一致性最好，且独立使用也完全不受框架限制。",
    "author": "Bootstrap",
    "tags": ["SVG图标", "Bootstrap", "数量丰富", "官方"],
    "actionType": "github",
    "repository": "https://github.com/twbs/icons",
    "homepage": "https://icons.getbootstrap.com",
    "stars": "8.1k+",
    "license": "MIT",
    "featured": false,
    "updatedAt": "2026-10-04"
  },
  {
    "id": "res:vault:material-design-icons",
    "name": "Material Symbols",
    "category": "icons",
    "description": "Google Material 设计体系的可变图标字体与 SVG 资源。",
    "recommendedReason": "支持字重、填充、光学尺寸多个可变轴，一个文件覆盖全部风格变体。",
    "author": "Google",
    "tags": ["Material设计", "可变图标", "图标字体", "Google"],
    "actionType": "github",
    "repository": "https://github.com/google/material-design-icons",
    "homepage": "https://fonts.google.com/icons",
    "stars": "54.1k+",
    "license": "Apache-2.0",
    "featured": true,
    "updatedAt": "2026-10-04"
  },
  {
    "id": "res:vault:tabler-icons",
    "name": "Tabler Icons",
    "category": "icons",
    "description": "超过五千枚统一网格的线性 SVG 图标，笔画风格高度一致。",
    "recommendedReason": "数量与一致性兼顾，做需要大量图标的复杂后台时缺口最少。",
    "author": "Tabler",
    "tags": ["SVG图标", "数量庞大", "线性风格", "网格统一"],
    "actionType": "github",
    "repository": "https://github.com/tabler/tabler-icons",
    "homepage": "https://tabler.io/icons",
    "stars": "21.9k+",
    "license": "MIT",
    "featured": true,
    "updatedAt": "2026-10-04"
  },
  {
    "id": "res:vault:phosphor-icons",
    "name": "Phosphor Icons",
    "category": "icons",
    "description": "提供六种字重变体的弹性图标家族，可在同一套图标中切换粗细。",
    "recommendedReason": "同一图标可随字重变化呼应排版层级，适合与可变字体搭配的现代界面。",
    "author": "Phosphor Icons",
    "tags": ["弹性图标", "多字重", "SVG", "排版呼应"],
    "actionType": "github",
    "repository": "https://github.com/phosphor-icons/core",
    "homepage": "https://phosphoricons.com",
    "stars": "384",
    "license": "MIT",
    "featured": false,
    "updatedAt": "2026-10-04"
  },
  {
    "id": "res:vault:iconoir",
    "name": "Iconoir",
    "category": "icons",
    "description": "风格克制的开源 SVG 图标库，线条圆润统一。",
    "recommendedReason": "线条轻柔不抢眼，适合需要温和视觉语气的产品界面。",
    "author": "Iconoir",
    "tags": ["SVG图标", "圆润线条", "克制风格", "开源"],
    "actionType": "github",
    "repository": "https://github.com/iconoir-icons/iconoir",
    "homepage": "https://iconoir.com",
    "stars": "4.6k+",
    "license": "MIT",
    "featured": false,
    "updatedAt": "2026-10-04"
  },
  {
    "id": "res:vault:simple-icons",
    "name": "Simple Icons",
    "category": "icons",
    "description": "汇集数千个品牌与产品的官方标志 SVG，附带品牌主色值。",
    "recommendedReason": "做技术栈展示与分享卡片时最省事的品牌图标源，且自带准确的品牌色。",
    "author": "Simple Icons",
    "tags": ["品牌图标", "品牌色", "SVG", "技术栈展示"],
    "actionType": "github",
    "repository": "https://github.com/simple-icons/simple-icons",
    "homepage": "https://simpleicons.org",
    "stars": "26k+",
    "license": "CC0-1.0",
    "featured": true,
    "updatedAt": "2026-10-04"
  },
  {
    "id": "res:vault:font-awesome",
    "name": "Font Awesome",
    "category": "icons",
    "description": "历史最悠久、覆盖面最广的图标字体与 SVG 图标工具包。",
    "recommendedReason": "品牌与界面图标兼收，遇到冷门符号时命中率仍然最高。",
    "author": "Font Awesome",
    "tags": ["图标字体", "老牌图标库", "品牌图标", "覆盖面广"],
    "actionType": "github",
    "repository": "https://github.com/FortAwesome/Font-Awesome",
    "homepage": "https://fontawesome.com",
    "stars": "76.9k+",
    "featured": true,
    "updatedAt": "2026-10-04"
  },
  {
    "id": "res:vault:remix-icon",
    "name": "Remix Icon",
    "category": "icons",
    "description": "中性风格的开源图标集，每个图标同时提供描边与填充版本。",
    "recommendedReason": "同一图标两种风格成对提供，切换状态时无需再找替代图标。",
    "author": "Remix Design",
    "tags": ["SVG图标", "描边填充", "成对提供", "中性风格"],
    "actionType": "github",
    "repository": "https://github.com/Remix-Design/RemixIcon",
    "homepage": "https://remixicon.com",
    "stars": "8.4k+",
    "featured": false,
    "updatedAt": "2026-10-04"
  },
  {
    "id": "res:vault:iconify",
    "name": "Iconify",
    "category": "icons",
    "description": "统一 API 聚合上百个开源图标集的框架无关图标解决方案。",
    "recommendedReason": "一个接口调用全部主流图标库并按需加载，彻底摆脱为图标引入多个依赖的麻烦。",
    "author": "Vjacheslav Trushkin",
    "tags": ["图标聚合", "统一API", "按需加载", "框架无关"],
    "actionType": "github",
    "repository": "https://github.com/iconify/iconify",
    "homepage": "https://iconify.design",
    "stars": "6.4k+",
    "license": "MIT",
    "featured": true,
    "updatedAt": "2026-10-04"
  }
]
