[
  {
    "id": "res:vault:framer-motion",
    "name": "Motion (Framer Motion)",
    "category": "animation",
    "description": "专为 React 打造的生产级声明式动画与手势交互物理引擎。",
    "recommendedReason": "极简 API 支持弹簧物理模型、布局过渡排布（layoutId）与复杂手势拖拽。",
    "author": "Motion Division",
    "tags": ["React动画", "物理弹簧", "手势交互", "布局过渡"],
    "actionType": "github",
    "repository": "https://github.com/motiondivision/motion",
    "homepage": "https://motion.dev",
    "stars": "25k+",
    "featured": true,
    "updatedAt": "2026-10-02"
  },
  {
    "id": "res:vault:gsap-core",
    "name": "GSAP",
    "category": "animation",
    "description": "工业级 JavaScript 动画平台，覆盖补间、时间轴、滚动驱动与 SVG 变形。",
    "recommendedReason": "时间轴模型与滚动联动能力至今无对手，复杂编排场景下比手写 requestAnimationFrame 可靠得多。",
    "author": "GreenSock (Webflow)",
    "tags": ["JS动画", "时间轴", "ScrollTrigger", "SVG"],
    "actionType": "github",
    "repository": "https://github.com/greensock/GSAP",
    "homepage": "https://gsap.com",
    "stars": "28.8k+",
    "featured": true,
    "updatedAt": "2026-10-04"
  },
  {
    "id": "res:vault:curve-anime",
    "name": "anime.js",
    "category": "animation",
    "description": "轻量而强大的 JavaScript 动画引擎，支持 CSS、SVG、DOM 属性与时间轴编排。",
    "recommendedReason": "体积小、API 直观，用 stagger 与 keyframes 就能做出细腻的序列动效。",
    "author": "Julian Garnier",
    "tags": ["轻量动画", "SVG动画", "序列编排", "微型库"],
    "actionType": "github",
    "repository": "https://github.com/juliangarnier/anime",
    "homepage": "https://animejs.com",
    "stars": "73.3k+",
    "license": "MIT",
    "featured": true,
    "updatedAt": "2026-10-04"
  },
  {
    "id": "res:vault:lottie-web-player",
    "name": "Lottie Web",
    "category": "animation",
    "description": "在 Web 端原生渲染 After Effects 导出的 Bodymovin JSON 矢量动画。",
    "recommendedReason": "设计稿动效无需逐帧导出视频即可保持矢量清晰度与极小体积，是营销页动效的通行方案。",
    "author": "Airbnb",
    "tags": ["矢量动效", "AE导出", "Bodymovin", "设计交付"],
    "actionType": "github",
    "repository": "https://github.com/airbnb/lottie-web",
    "homepage": "https://lottie.airbnb.tech/",
    "stars": "32.1k+",
    "license": "MIT",
    "featured": true,
    "updatedAt": "2026-10-04"
  },
  {
    "id": "res:vault:auto-animate-lib",
    "name": "AutoAnimate",
    "category": "animation",
    "description": "一行代码即可为列表增删、排序与展开收起自动补齐过渡动画的零配置库。",
    "recommendedReason": "把动画成本压到接近零，且不改变 DOM 结构，适合在既有项目中低成本提升手感。",
    "author": "FormKit",
    "tags": ["零配置", "列表动效", "FLIP", "易接入"],
    "actionType": "github",
    "repository": "https://github.com/formkit/auto-animate",
    "homepage": "https://auto-animate.formkit.com",
    "stars": "13.9k+",
    "license": "MIT",
    "featured": false,
    "updatedAt": "2026-10-04"
  },
  {
    "id": "res:vault:rive-wasm",
    "name": "Rive",
    "category": "animation",
    "description": "以运行时 WASM 播放实时可交互矢量动画的引擎，支持状态机驱动。",
    "recommendedReason": "动画图可响应输入并做逻辑分支，是替代 Lottie 做可交互吉祥物与图标动效的方案。",
    "author": "Rive",
    "tags": ["交互式动画", "WASM运行时", "状态机", "实时渲染"],
    "actionType": "github",
    "repository": "https://github.com/rive-app/rive-wasm",
    "homepage": "https://rive.app",
    "stars": "970",
    "license": "MIT",
    "featured": false,
    "updatedAt": "2026-10-04"
  },
  {
    "id": "res:vault:popmotion",
    "name": "Popmotion",
    "category": "animation",
    "description": "以函数式风格构建的 JavaScript 物理动画基础库，弹簧与衰减模型可直接组合。",
    "recommendedReason": "Framer Motion 的底层动能来源，适合需要手写自定义运动模型而不要框架绑定的场景。",
    "author": "Popmotion",
    "tags": ["物理动画", "函数式", "弹簧模型", "基础库"],
    "actionType": "github",
    "repository": "https://github.com/Popmotion/popmotion",
    "stars": "20.2k+",
    "featured": false,
    "updatedAt": "2026-10-04"
  },
  {
    "id": "res:vault:theatre-studio",
    "name": "Theatre.js",
    "category": "animation",
    "description": "浏览器内的动效设计与编辑套件，把视觉序列编辑器带进前端工作流。",
    "recommendedReason": "像用 AE 一样在页面里逐帧编排并直接保存为代码可用序列，弥补设计师与工程师之间的缺口。",
    "author": "Theatre.js",
    "tags": ["动效编辑器", "可视化编排", "序列编辑器", "设计协作"],
    "actionType": "github",
    "repository": "https://github.com/theatre-js/theatre",
    "homepage": "https://www.theatrejs.com",
    "stars": "12.7k+",
    "license": "Apache-2.0",
    "featured": false,
    "updatedAt": "2026-10-04"
  },
  {
    "id": "res:vault:animate-css",
    "name": "Animate.css",
    "category": "animation",
    "description": "现成可用的 CSS 关键帧动画类库，覆盖进出场与注意力引导等常见效果。",
    "recommendedReason": "给一个 class 就有动效，适合原型、演示与低投入的界面点缀。",
    "author": "Daniel Eden",
    "tags": ["CSS动画", "关键帧", "即插即用", "原型"],
    "actionType": "github",
    "repository": "https://github.com/animate-css/animate.css",
    "homepage": "https://animate.style",
    "stars": "82.8k+",
    "featured": false,
    "updatedAt": "2026-10-04"
  },
  {
    "id": "res:vault:mojs-motion",
    "name": "mo.js",
    "category": "animation",
    "description": "面向动效设计的 JavaScript 运动图形库，专注形状、爆发与拖尾效果。",
    "recommendedReason": "内置 burst、swirl 等运动图形原语，做庆祝反馈与加载动效比通用动画库更省事。",
    "author": "Legomushroom",
    "tags": ["运动图形", "形状动画", "爆发效果", "创意动效"],
    "actionType": "github",
    "repository": "https://github.com/mojs/mojs",
    "homepage": "https://mojs.github.io",
    "stars": "18.8k+",
    "license": "MIT",
    "featured": false,
    "updatedAt": "2026-10-04"
  },
  {
    "id": "res:vault:typed-js",
    "name": "Typed.js",
    "category": "animation",
    "description": "实现打字机式逐字输出与循环多串文本的轻量 JavaScript 库。",
    "recommendedReason": "首屏标语与终端感文案的经典做法，几行配置即可控制速度、回删与循环。",
    "author": "Matt Boldt",
    "tags": ["打字机效果", "文本动画", "首屏文案", "轻量"],
    "actionType": "github",
    "repository": "https://github.com/mattboldt/typed.js",
    "stars": "16.3k+",
    "license": "GPL-3.0",
    "featured": false,
    "updatedAt": "2026-10-04"
  },
  {
    "id": "res:vault:barba-transitions",
    "name": "Barba.js",
    "category": "animation",
    "description": "为多页应用提供无刷新页面跳转与转场编排的轻量库。",
    "recommendedReason": "在不引入 SPA 的前提下获得单页转场体验，保留服务端渲染与原生链接可访问性。",
    "author": "Barba.js",
    "tags": ["页面转场", "SPA体验", "多页应用", "无刷新"],
    "actionType": "github",
    "repository": "https://github.com/barbajs/barba",
    "homepage": "https://barba.js.org",
    "stars": "13k+",
    "license": "MIT",
    "featured": false,
    "updatedAt": "2026-10-04"
  }
]
