[
  {
    "id": "res:vault:developer-roadmap",
    "name": "Developer Roadmaps",
    "category": "learning",
    "description": "全球开发者社区共同维护的前端、后端、DevOps 及 AI 学习全景路线图。",
    "recommendedReason": "初学者与进阶工程师梳理技术盲区与成体系系统化学习的必备路线指南。",
    "author": "roadmap.sh",
    "tags": ["路线图", "技术指南", "学习路径", "系统成长"],
    "actionType": "external",
    "homepage": "https://roadmap.sh",
    "repository": "https://github.com/kamranahmedse/developer-roadmap",
    "stars": "305k+",
    "featured": true,
    "updatedAt": "2026-10-03"
  },
  {
    "id": "res:vault:system-design-primer",
    "name": "System Design Primer",
    "category": "learning",
    "description": "学习如何设计大规模、高并发、高可用与高可扩展系统的开创性架构经典指南。",
    "recommendedReason": "深入浅出拆解缓存策略、负载均衡、分库分表、微服务异步通信等分布式核心命题。",
    "author": "Donne Martin",
    "tags": ["系统设计", "高并发", "分布式架构", "架构师必读"],
    "actionType": "github",
    "repository": "https://github.com/donnemartin/system-design-primer",
    "stars": "288k+",
    "license": "CC-BY-SA-4.0",
    "featured": true,
    "updatedAt": "2026-10-03"
  },
  {
    "id": "res:vault:missing-semester",
    "name": "The Missing Semester of Your CS Education",
    "category": "learning",
    "description": "MIT 计算机系知名公开课：大学课程中往往忽略但至关重要的命令行与工具链实战课程。",
    "recommendedReason": "掌握 Shell 脚本、Vim 高效编辑、Git 数据模型与命令行调试器，事半功倍。",
    "author": "MIT (Anish, Jon, Jose)",
    "tags": ["MIT公开课", "工具链哲学", "命令行精进", "终身受用"],
    "actionType": "external",
    "homepage": "https://missing.csail.mit.edu",
    "featured": true,
    "updatedAt": "2026-10-03"
  },
  {
    "id": "res:vault:patterns-dev",
    "name": "Patterns.dev",
    "category": "learning",
    "description": "关于使用现代 Web 技术构建高性能、弹性和可维护应用的免费设计模式电子书。",
    "recommendedReason": "系统讲解渲染模式（SSR/SSG/ISR）、组件设计模式与前端代码拆分优化哲学。",
    "author": "Lydia Hallie & Addy Osmani",
    "tags": ["设计模式", "架构思维", "性能优化", "Web技术"],
    "actionType": "external",
    "homepage": "https://www.patterns.dev",
    "featured": true,
    "updatedAt": "2026-10-03"
  },
  {
    "id": "res:vault:rust-by-example",
    "name": "Rust By Example",
    "category": "learning",
    "description": "通过丰富精炼、可直接在浏览器运行编辑的简明代码实例学习 Rust 核心语言概念。",
    "recommendedReason": "避开长篇抽象理论，在边改代码边跑编译报错中快速建立所有权、生命周期与特征肌肉记忆。",
    "author": "Rust Community",
    "tags": ["Rust实战", "交互示例", "官方教程", "零痛苦上手"],
    "actionType": "external",
    "homepage": "https://doc.rust-lang.org/rust-by-example",
    "featured": false,
    "updatedAt": "2026-10-03"
  },
  {
    "id": "res:vault:cs-video-courses",
    "name": "CS Video Courses",
    "category": "learning",
    "description": "整理 MIT、CMU、Stanford、UC Berkeley 等全球世界名校公开计算机视频与讲义目录。",
    "recommendedReason": "操作系统、体系结构、分布式系统顶级公开课汇总，系统学好计算机底层。",
    "author": "Developer Community",
    "tags": ["名校公开课", "计算机基础", "操作系统", "分布式系统"],
    "actionType": "github",
    "repository": "https://github.com/Developer-Y/cs-video-courses",
    "stars": "66k+",
    "license": "MIT",
    "featured": false,
    "updatedAt": "2026-10-03"
  },
  {
    "id": "res:vault:clean-code-javascript",
    "name": "Clean Code JavaScript",
    "category": "learning",
    "description": "将《代码整洁之道》工程原则深度适配到现代 JavaScript 的实用实践手册。",
    "recommendedReason": "学习如何写出可读性极高、无副作用、命名精准且利于团队长线维护的优质工程代码。",
    "author": "Ryan McDermott",
    "tags": ["整洁代码", "可维护性", "重构哲学", "代码异味消除"],
    "actionType": "github",
    "repository": "https://github.com/ryanmcdermott/clean-code-javascript",
    "stars": "91k+",
    "license": "MIT",
    "featured": false,
    "updatedAt": "2026-10-03"
  },
  {
    "id": "res:vault:freecodecamp",
    "name": "freeCodeCamp",
    "category": "learning",
    "description": "完全免费且全球规模最大的开源互动式全栈编程学习社区与项目实践平台。",
    "recommendedReason": "从零基础到独立做出真实商业级 Web 应用程序，包含成千上万道阶梯式编码闯关题。",
    "author": "freeCodeCamp.org",
    "tags": ["交互闯关", "全栈实战", "零基础友好", "完全免费"],
    "actionType": "github",
    "repository": "https://github.com/freeCodeCamp/freeCodeCamp",
    "homepage": "https://www.freecodecamp.org",
    "stars": "408k+",
    "license": "BSD-3-Clause",
    "featured": true,
    "updatedAt": "2026-10-03"
  },
  {
    "id": "res:vault:cs-notes",
    "name": "CS-Notes",
    "category": "learning",
    "description": "技术面试必备基础知识、LeetCode 题解、计算机网络、操作系统与系统设计全景提炼。",
    "recommendedReason": "中文技术社区知名度与整理深度极高的计算机核心知识体系开源笔记。",
    "author": "CyC2018",
    "tags": ["技术面试", "计算机基础", "LeetCode", "中文必读"],
    "actionType": "github",
    "repository": "https://github.com/CyC2018/CS-Notes",
    "homepage": "http://www.cyc2018.xyz",
    "stars": "172k+",
    "license": "CC-BY-NC-SA-4.0",
    "featured": true,
    "updatedAt": "2026-10-03"
  },
  {
    "id": "res:vault:visualizing-git",
    "name": "Visualizing Git",
    "category": "learning",
    "description": "在交互式动态拓扑图中直观观察 Git commit、branch、checkout、rebase 的生动演化过程。",
    "recommendedReason": "告别抽象晦涩的命令行黑盒，用最直观的可视化图解彻底吃透 Git 底层 DAG 数据结构。",
    "author": "GitKraken / Jason Long",
    "tags": ["Git可视化", "交互教学", "图解DAG", "新手利器"],
    "actionType": "external",
    "homepage": "https://git-school.github.io/visualizing-git",
    "featured": true,
    "updatedAt": "2026-10-03"
  },
  {
    "id": "res:vault:full-stack-open",
    "name": "Full Stack Open",
    "category": "learning",
    "description": "芬兰赫尔辛基大学享誉全球的现代 Web 全栈深度开源课程，涵盖 React、Node、GraphQL、CI/CD 与容器。",
    "recommendedReason": "大学顶尖教研团队持续按当年最新规范重构课程，代码严谨规范度极高。",
    "author": "University of Helsinki",
    "tags": ["名校课程", "现代全栈", "React深度", "免费认证"],
    "actionType": "external",
    "homepage": "https://fullstackopen.com/zh",
    "featured": true,
    "updatedAt": "2026-10-03"
  },
  {
    "id": "res:vault:teach-yourself-cs",
    "name": "Teach Yourself Computer Science",
    "category": "learning",
    "description": "非科班工程师与在校生自学计算机科学 9 大学科的核心书单与公开课推荐指南。",
    "recommendedReason": "精选各领域一本最好教材（如《深入理解计算机系统》《编译原理》），路径极度聚焦。",
    "author": "Bradfield School of Computer Science",
    "tags": ["CS自学", "经典教材", "底层筑基", "书单推荐"],
    "actionType": "external",
    "homepage": "https://teachyourselfcs.com",
    "featured": true,
    "updatedAt": "2026-10-03"
  }
]
