[
  {
    "id": "res:vault:godly-website",
    "name": "Godly Website",
    "category": "frontend",
    "description": "每日更新的世界顶级现代 Web 设计、排版与微交互精选画廊。",
    "recommendedReason": "寻找现代产品主页、暗黑界面与极致版面留白灵感的第一去处。",
    "author": "Godly Team",
    "tags": ["设计灵感", "落地页", "版式排版", "微交互"],
    "actionType": "external",
    "homepage": "https://godly.website",
    "featured": true,
    "updatedAt": "2026-10-02"
  },
  {
    "id": "res:vault:awwwards",
    "name": "Awwwards",
    "category": "frontend",
    "description": "全球顶尖数字设计师与开发者的年度/每日获奖作品评选平台。",
    "recommendedReason": "了解当下世界最高技术力 3D WebGL、复杂动效与突破性网页叙事。",
    "author": "Awwwards Jury",
    "tags": ["行业大奖", "前沿交互", "3D Web", "创新排版"],
    "actionType": "external",
    "homepage": "https://www.awwwards.com",
    "featured": true,
    "updatedAt": "2026-10-02"
  },
  {
    "id": "res:vault:webby-awards",
    "name": "The Webby Awards",
    "category": "frontend",
    "description": "被誉为「互联网奥斯卡」的全球数字艺术与科学最高国际荣誉大奖。",
    "recommendedReason": "洞悉全球最高规格数字产品、文化叙事与品牌交互的年度风向标。",
    "author": "IADAS",
    "tags": ["国际大奖", "数字奥斯卡", "品牌体验", "全景评审"],
    "actionType": "external",
    "homepage": "https://www.webbyawards.com",
    "featured": true,
    "updatedAt": "2026-10-03"
  },
  {
    "id": "res:vault:fwa",
    "name": "FWA (Favorite Website Awards)",
    "category": "frontend",
    "description": "自 2000 年创立、见证现代 Web 交互进化史的前沿数字创新大奖。",
    "recommendedReason": "探索技术突破极限：WebGL 着色器、生成式音频与沉浸式空间界面实验。",
    "author": "FWA Jury",
    "tags": ["行业大奖", "技术突破", "前沿WebGL", "沉浸交互"],
    "actionType": "external",
    "homepage": "https://thefwa.com",
    "featured": true,
    "updatedAt": "2026-10-03"
  },
  {
    "id": "res:vault:siteinspire",
    "name": "SiteInspire",
    "category": "frontend",
    "description": "严选真正具备克制美感、清晰架构与优秀排版的 Web 视觉样本档案库。",
    "recommendedReason": "支持按行业、构图类型、交互风格与色彩多维交叉筛选，审美极高。",
    "author": "Daniel Howells",
    "tags": ["设计样本", "多维筛选", "克制美感", "版面架构"],
    "actionType": "external",
    "homepage": "https://www.siteinspire.com",
    "featured": true,
    "updatedAt": "2026-10-03"
  },
  {
    "id": "res:vault:saas-interfaces",
    "name": "SaaS Interfaces",
    "category": "frontend",
    "description": "专注于世界顶尖 B2B 与开发工具类商业软件界面排版与交互细节分析。",
    "recommendedReason": "参考 Linear、Stripe、Vercel、Raycast 的复杂信息架构与微交互处理。",
    "author": "SaaS Interfaces Curators",
    "tags": ["SaaS产品", "B2B界面", "控制台", "微细节"],
    "actionType": "external",
    "homepage": "https://saasinterface.com",
    "updatedAt": "2026-10-03"
  },
  {
    "id": "res:vault:refero",
    "name": "Refero",
    "category": "frontend",
    "description": "收录数千款优质真实 Web 与 iOS 应用的像素级界面与真实交互流截图。",
    "recommendedReason": "按具体页面类型（Onboarding、Pricing、Settings、Table）检索设计参考。",
    "author": "Refero Team",
    "tags": ["真实截屏", "按页面分类", "交互流程", "设计参考"],
    "actionType": "external",
    "homepage": "https://refero.design",
    "updatedAt": "2026-10-03"
  },
  {
    "id": "res:vault:magic-ui",
    "name": "Magic UI",
    "category": "frontend",
    "description": "专为打造令人惊叹的现代 Landing Page 构建的 React + Tailwind 高表现力组件库。",
    "recommendedReason": "一键复制光束边框、流光文字、拟物网格与平滑卡片，显著提升产品吸睛度。",
    "author": "Dillion Verma",
    "tags": ["LandingPage", "高表现力", "流光动画", "Tailwind"],
    "actionType": "external",
    "homepage": "https://magicui.design",
    "featured": true,
    "updatedAt": "2026-10-03"
  },
  {
    "id": "res:vault:aceternity-ui",
    "name": "Aceternity UI",
    "category": "frontend",
    "description": "当下最热门的高风格化前端动效组件库，包含未来主义背景、悬停卡片与先锋排版。",
    "recommendedReason": "为开发者提供开箱即用的高阶 Framer Motion 与 Tailwind 交互组件，直接复制源码。",
    "author": "Manu Arora",
    "tags": ["先锋动效", "未来感", "Framer Motion", "复制代码"],
    "actionType": "external",
    "homepage": "https://ui.aceternity.com",
    "featured": true,
    "updatedAt": "2026-10-03"
  },
  {
    "id": "res:vault:bentogrids",
    "name": "Bento Grids",
    "category": "frontend",
    "description": "精选 Apple、Linear 风格便当盒栅格布局（Bento Grid）案例库。",
    "recommendedReason": "现代 SaaS 官网特性展示与仪表板信息架构必学的卡片排布规范。",
    "author": "Bento Grids Curators",
    "tags": ["便当盒布局", "Bento", "SaaS界面", "卡片排版"],
    "actionType": "external",
    "homepage": "https://bentogrids.com",
    "featured": true,
    "updatedAt": "2026-10-02"
  },
  {
    "id": "res:vault:adamschwartz-log",
    "name": "Log",
    "category": "frontend",
    "description": "把 console.log 的输出重定向到页面上的可视化控制台面板。",
    "recommendedReason": "在移动端与无法开控制台的场景下直接观察日志，调试体验远超 alert 与逐行断点。",
    "author": "Adam Schwartz",
    "tags": ["调试工具", "控制台", "移动端调试", "可视化日志"],
    "actionType": "github",
    "repository": "https://github.com/adamschwartz/log",
    "homepage": "https://adamschwartz.co/log",
    "stars": "3k+",
    "license": "MIT",
    "featured": false,
    "updatedAt": "2026-10-04"
  },
  {
    "id": "res:vault:awesome-web-dev-resources",
    "name": "Awesome Web Dev Resources",
    "category": "frontend",
    "description": "面向现代 Web 开发者的资源汇总，涵盖工具、文档、设计与工程实践。",
    "recommendedReason": "内容精简不堆量，每项都是作者实际使用过的工具，适合作为个人工具的补齐清单。",
    "author": "Zander Martineau",
    "tags": ["资源清单", "Web开发", "工具推荐", "精简"],
    "actionType": "github",
    "repository": "https://github.com/mrmartineau/awesome-web-dev-resources",
    "stars": "284",
    "featured": false,
    "updatedAt": "2026-10-04"
  },
  {
    "id": "res:vault:design-resources-for-developers",
    "name": "Design Resources for Developers",
    "category": "frontend",
    "description": "为开发者整理的 UI 设计资源大全，含插图、图标、配色、字体与模板站点。",
    "recommendedReason": "缺少设计师时最实用的一张清单，直接解决插图与配色从哪找的问题。",
    "author": "Brad Traversy",
    "tags": ["设计资源", "插图", "配色方案", "模板"],
    "actionType": "github",
    "repository": "https://github.com/bradtraversy/design-resources-for-developers",
    "stars": "67.1k+",
    "license": "MIT",
    "featured": true,
    "updatedAt": "2026-10-04"
  },
  {
    "id": "res:vault:webgems",
    "name": "WebGems",
    "category": "frontend",
    "description": "面向 Web 开发者的精选资源导航站，按语言与主题分类编排。",
    "recommendedReason": "分类维度贴合实际工作场景，是补充书签栏的轻量入口。",
    "author": "WebGems",
    "tags": ["资源导航", "精选推荐", "Web开发", "轻量"],
    "actionType": "github",
    "repository": "https://github.com/webgems/webgems",
    "homepage": "https://webgems.io",
    "stars": "55",
    "featured": false,
    "updatedAt": "2026-10-04"
  },
  {
    "id": "res:vault:css-protips",
    "name": "CSS Protips",
    "category": "frontend",
    "description": "一份实用的 CSS 技巧合集，涵盖布局、选择器、性能与兼容性。",
    "recommendedReason": "每条都能立刻用在项目里，是提升 CSS 手感的低成本读物。",
    "author": "Matt Smith",
    "tags": ["CSS技巧", "实用合集", "布局", "性能"],
    "actionType": "github",
    "repository": "https://github.com/AllThingsSmitty/css-protips",
    "stars": "30.3k+",
    "license": "CC0-1.0",
    "featured": true,
    "updatedAt": "2026-10-04"
  },
  {
    "id": "res:vault:dropin-minimal-css",
    "name": "Drop-in Minimal CSS",
    "category": "frontend",
    "description": "数十种极简无类 CSS 框架的集中预览与切换对比页。",
    "recommendedReason": "给语义化 HTML 套一个 classless 框架就能成页，做文档、原型与纯内容站的最短路径。",
    "author": "Dohliam",
    "tags": ["无类CSS", "极简框架", "对比预览", "原型"],
    "actionType": "github",
    "repository": "https://github.com/dohliam/dropin-minimal-css",
    "homepage": "https://dohliam.github.io/dropin-minimal-css",
    "stars": "1.8k+",
    "license": "MIT",
    "featured": false,
    "updatedAt": "2026-10-04"
  },
  {
    "id": "res:vault:awesome-css-frameworks",
    "name": "Awesome CSS Frameworks",
    "category": "frontend",
    "description": "按类别整理的 CSS 框架清单，区分基础类、实用优先与无类框架。",
    "recommendedReason": "选框架前先看清分类与定位，避免把工具类框架当成组件库来用。",
    "author": "Troxler",
    "tags": ["CSS框架", "选型对比", "分类整理", "清单"],
    "actionType": "github",
    "repository": "https://github.com/troxler/awesome-css-frameworks",
    "stars": "9.5k+",
    "featured": false,
    "updatedAt": "2026-10-04"
  }
]
